Cites,Authors,Title,Year,Source,Publisher,ArticleURL,CitesURL,GSRank,QueryDate,Type,DOI,ISSN,CitationURL,Volume,Issue,StartPage,EndPage,ECC,CitesPerYear,CitesPerAuthor,AuthorCount,Age,Abstract,FullTextURL,RelatedURL,Term,Mandiberg,Is Term,Original Sort Order,Check Fulltext,Type,Project,local_filename,special
0,M Donatelli,Un'inquadratura: la biblioteca e l'universo femminile,2021,Biblioteche oggi,bibliotecheoggi.it,http://www.bibliotecheoggi.it/rivista/article/view/1309,,426,12/23/24 20:52,,,,,,,,,0,0,0,1,3,"… For, ChinwE nwogo EZEani, Unveiling the Veiled: Wikipedia Collaborating with Academic Libraries in Africa in Creating Visibility for African Women Through Art+Feminism Wikipedia …",https://iris.uniroma3.it/retrieve/e397d80e-e7cb-b0de-e053-6605fe0a1c76/Donatelli%2C%20Michela_%20Un%27inquadratura.pdf,,Art+Feminism,TRUE,TRUE,426,,0,0,0
58,D Kozlu,Modernizm sonrası postmodern hareket içinde kadının yeri,2009,Art-e Sanat Dergisi,dergipark.org.tr,https://dergipark.org.tr/en/pub/sduarte/article/221425,"https://scholar.google.com/scholar?cites=905659249364893964&as_sdt=2005&sciodt=0,5&hl=en",427,12/23/24 20:52,,,,,,,,,58,3.87,58,1,15,"… yaşadığı çifte dışlanmaya, kadınların yaşadıkları baskıyı göstermeleri açısından “Psychoanalyse et Politique” (Politik-Psikanaliz) grubunun yanında yer alarak karşı durmuştur (wikipedia…",https://dergipark.org.tr/en/download/article-file/193313,,Art+Feminism,FALSE,FALSE,427,,0,0,0
7,"A Boccone, C Forziati, T Maio, R Rivelli","Valorizzazione dei fondi privati in una biblioteca accademica: divulgazione, comunicazione, ricerca",2017,Bibliothecae. it,bibliothecae.unibo.it,https://bibliothecae.unibo.it/article/view/7703,"https://scholar.google.com/scholar?cites=8052623009875481597&as_sdt=2005&sciodt=0,5&hl=en",428,12/23/24 20:52,,,,,,,,,7,1,2,4,7,… La riflessione sulle potenzialità dei progetti wiki per la … nel corso dell’evento internazionale Art+Feminism per il 2017 e le … su Art+Feminism si veda <https://it.wikipedia.org/wiki/Progetto…,https://bibliothecae.unibo.it/article/download/7703/7432,,Art+Feminism,TRUE,TRUE,428,,0,0,0
0,H Stadler,Die Politik des Cyberspace,,unipub.uni-graz.at,,https://unipub.uni-graz.at/obvugrhs/content/titleinfo/10133680/full.pdf,,429,12/23/24 20:52,PDF,,,,,,,,0,0,0,1,,"… the platform Wikipedia. … Wikipedia raised great hopes with regard to the possibilities of diversifying knowledge production. However, the shaping of knowledge on the platform Wikipedia …",https://unipub.uni-graz.at/obvugrhs/content/titleinfo/10133680/full.pdf,,Art+Feminism,FALSE,,429,,0,0,0
0,"LM Bridges, C Llebot",Los bibliotecarios como organizadores del movimiento Wikimedia en España: una investigación interpretiva que explora las actividades y sus motivaciones,2021,First Monday,ir.library.oregonstate.edu,https://ir.library.oregonstate.edu/concern/articles/3b591h64c,,430,12/23/24 20:52,,,,,,,,,0,0,0,2,3,"… Wikipedia y con los bibliotecarios de fuera de España, con la esperanza de que esto … Cada mes un billón de dispositivos acceden a Wikipedia, la única web sin ánimo de …",https://ir.library.oregonstate.edu/downloads/sf268d10t,,Art+Feminism,TRUE,,430,,discussion,0,0
0,A Giunta,From Rio de la Plata to the Extreme West: Feminist Historiographies of Art and Artistic Activism in Argentina and Chile,2024,Ikonotheka,bibliotekanauki.pl,https://bibliotekanauki.pl/articles/50672821.pdf,,431,12/23/24 20:52,PDF,,,,,,,,0,0,0,1,1,"… as workers, for the federalization of art feminism and for the recognition of women artists … Fine Arts, to incorporate biographies of women artists to Wikipedia. In the artistic field, there are …",https://bibliotekanauki.pl/articles/50672821.pdf,,Art+Feminism,FALSE,,431,,0,0,0
0,"S Juan, E Oller",Uso de los ordenadores en los institutos por los jóvenes en el programa 2.0 de España,2019,Pedagogías emergentes en la sociedad digital,diposit.ub.edu,https://diposit.ub.edu/dspace/bitstream/2445/133194/4/Pedagogi%CC%81as%20emergentes%20en%20la%20sociedad%20digital.pdf#page=106,,432,12/23/24 20:52,PDF,,,,,,,,0,0,0,2,5,… Resumen: Wikipedia es la enciclopedia en formato digital … presentar la situación actual de Wikipedia en relación a la brecha … mujeres que se han llevado a cabo (Art+ Feminism. 2018). …,https://diposit.ub.edu/dspace/bitstream/2445/133194/4/Pedagogi%CC%81as%20emergentes%20en%20la%20sociedad%20digital.pdf#page=106,,Art+Feminism,TRUE,TRUE,432,,0,0,0
0,E SOBRELab,III ENCUENTROS SOBRE DINÁMICAS DE COMU--NICACIÓN ACTUALES EN EL ARTE CONTEMPO--RÁNEO.,2024,SOBRE Lab,search.ebscohost.com,https://search.ebscohost.com/login.aspx?direct=true&profile=ehost&scope=site&authtype=crawler&jrnl=23871733&AN=176257734&h=Sue%2FAxS5Pq7VXyKkADso%2FDoZKSdTa6QzIPJNAFN%2FRKmySGBt6ETv1ttFm3yuZvycqr9QRqFwdEyQkrYj%2Btw9Yg%3D%3D&crl=c,,433,12/23/24 20:52,,,,,,,,,0,0,0,1,1,… remiten desde sus sitios web a Wikipedia para consultar la biografía de artistas … ART+FEMINISM (9) están haciendo una importante labor para reducir la brecha de género en Wikipedia …,,,Art+Feminism,TRUE,TRUE,433,,0,Art+Feminism,E_SOBRELab_III_ENCUENTROS_SOBRE_DINÁMICAS_DE_COMU--NICACIÓN_ACTUALES_EN_EL_ARTE_CONTEMPO--RÁNEO..pdf
0,О Чепелик,Арт+ фемінізм 2020: український і світовий контексти,2020,Мистецтвознавство України,mystukr.mari.kyiv.ua,http://mystukr.mari.kyiv.ua/article/view/220928,,434,12/23/24 20:52,,,,,,,,,0,0,0,1,4,"… художниць, яка представлена в проекті “Art + Feminism 2020ˮ. Її творчість і проект “… The fruitfulness of efforts to reduce the gender gap in Wikipedia in order to highlight the …",http://mystukr.mari.kyiv.ua/article/download/220928/224637,,Art+Feminism,TRUE,TRUE,434,,0,0,0
0,FC Silva Dos Santos,"Mujer, casa y nuevos medios: el arte de tejer en red, una propuesta experimental artística neomedial",2015,,riunet.upv.es,https://riunet.upv.es/handle/10251/58774,,435,12/23/24 20:52,,,,,,,,,0,0,0,1,9,"[ES] RESUMEN DE LA TESIS La casa ha transformado su arquitectura después de la inclusión de los nuevos medios de comunicación. Siguiendo el planteamiento de Paul Virilio, …","https://riunet.upv.es/bitstream/handle/10251/58774/SILVA%20-%20MUJER,%20CASA%20Y%20NUEVOS%20MEDIOS%3A%20EL%20ARTE%20DE%20TEJER%20EN%20RED,%20UNA%20PROPUESTA%20EXPERIMENTAL%20ART%C3%8DSTIC....pdf?sequence=1",,Art+Feminism,FALSE,,435,,0,0,0
0,K Deepwell,"Correções, interrogatórios e políticas de intercâmbio local/global na crítica de arte feminista",2024,Revista do Instituto de Estudos Brasileiros,revistas.usp.br,https://www.revistas.usp.br/rieb/article/view/225704,,436,12/23/24 20:52,,,,,,,,,0,0,0,1,1,"… Art+Feminism’s interventions on Wikipedia all attest). This trope to explain “greatness” for a few, as a substitute for the actual cultural absence of women, is even more prevalent in neo-…",https://www.revistas.usp.br/rieb/article/download/225704/204991,,Art+Feminism,TRUE,TRUE,436,,0,0,0
3,MA Trasforini,A paso distinto. Arte y feminismo en Italia desde los años setenta,2023,MODOS,sfera.unife.it,https://sfera.unife.it/bitstream/11392/2525990/1/13.Maria%2BAntonietta%2BTrasforini.pdf,"https://scholar.google.com/scholar?cites=10200368171351312936&as_sdt=2005&sciodt=0,5&hl=en",437,12/23/24 20:52,PDF,,,,,,,,3,3,3,1,1,"… https://it.wikipedia.org/wiki/Rivolta_Femminile. 15 En particular, veáse la reedición en 2010 de Autoritratto (1969), una obra desparecida durante década del mercado del libro, algunos …",https://sfera.unife.it/bitstream/11392/2525990/1/13.Maria%2BAntonietta%2BTrasforini.pdf,,Art+Feminism,FALSE,,437,,FALSE,0,0
0,ضِيَاء الدّيْن حَيْدَر عَبْد الْحَکِيم…,عِلْم الْجَمَال مَن المَنْظُور النِّسْوِيَّ (دِراسّة تَحْلِيّلية نَقْدِية مُعاصَرة)‎,,"مجلة بحوث کلية الآداب …, 2020‎",sjam.journals.ekb.eg,https://sjam.journals.ekb.eg/article_126131.html,,438,12/23/24 20:52,,,,,,,,,0,0,0,2,,"يَتَنَاوَل هَذَا الْبَحْثُ مَوْضُوعَ ""عِلْم الْجَمَال مَن المَنْظُورِ النِّسْوِيَّ""،وذَلِکَ مِنْ خِلالِ عَرضِ بَعْضِ المَفْاهِيمِ وَالقَضْايَا الَّتِي أَثَّرَت فِي تَهْمِيشِ دَورِ الْمَرْأَةِ فِي مَجَالِ عِلْمِ الْجَمَالِ وَفَلْسَفَة الْفَنِّ؛ کالجندر،والْمَذْهَبِ الشَّکْلِيّ، …‎",https://sjam.journals.ekb.eg/article_126131_37e484cab9cacd4f9f633b5f40ff603a.pdf,,Art+Feminism,FALSE,,438,,FALSE,0,0
0,S SHOW,HESSIE,2019,,galeriearnaudlefebvrearchives.com,http://galeriearnaudlefebvrearchives.com/hessie/wp-content/uploads/ddp-Hessie-Art-Paris-anglais.compressed.pdf,,439,12/23/24 20:52,PDF,,,,,,,,0,0,0,1,5,"How is it possible that after a solo show at ARC in 1975, making her debuts in Yvon Lambert’s prestigious gallery, exhibitions in Sweden (Lund Konsthall in 1978) and the USA, notably …",http://galeriearnaudlefebvrearchives.com/hessie/wp-content/uploads/ddp-Hessie-Art-Paris-anglais.compressed.pdf,,Art+Feminism,FALSE,,439,,0,0,0
0,MB Castro,Wikipédia e usos da História: a edição de uma história pública digital por historiadores e multidões,2021,,lume.ufrgs.br,https://lume.ufrgs.br/handle/10183/233772,,440,12/23/24 20:52,,,,,,,,,0,0,0,1,3,"… consumo das informações da Wikipedia e traduz seu destaque. De modo sucinto, esta investigação propõe o entrelaçamento entre o campo da História e a Wikipedia percebendo, nas …",https://lume.ufrgs.br/bitstream/handle/10183/233772/001135665.pdf?sequence=1,,Art+Feminism,FALSE,,440,,0,0,0
0,L Agius,The Malta Artpaper: No. 13: December 2020-March 2021,2020,,um.edu.mt,https://www.um.edu.mt/library/oar/handle/123456789/72529,,441,12/23/24 20:52,,,,,,,,,0,0,0,1,4,"… CG: My next opportunity will be a work as part of Art + Feminism at Spazju Kreattiv, where I will be performing live a story about female orgasms – this is a short story written by myself, …",https://www.um.edu.mt/library/oar/bitstream/123456789/72529/1/ARTPAPER%20ISSUE%2013%20ISSUU.pdf,,Art+Feminism,TRUE,TRUE,441,,0,0,0
1,SA Fiore,"Crowdsource Your Library, Engage Your Community",2018,,torrossa.com,https://www.torrossa.com/gs/resourceProxy?an=5526755&publisher=FZ0661,"https://scholar.google.com/scholar?cites=901564893633648220&as_sdt=2005&sciodt=0,5&hl=en",442,12/23/24 20:52,,,,,,,,,1,0.17,1,1,6,"I learned about crowdsourcing accidentally and long before I became a librarian. In another life I was an actor and still remain a great fan of William Shakespeare. Some years ago, I …",,,Art+Feminism,FALSE,,442,,0,0,0
0,MF Mojica López,Encontrarnos en la virtualidad: la creación de espacios (más) seguros en internet desde una perspectiva (trans) feminista e interseccional.,2022,,riull.ull.es,https://riull.ull.es/xmlui/handle/915/31784,,443,12/23/24 20:52,,,,,,,,,0,0,0,1,2,"… Además, algunas comunidades como Art+Feminism apuestan por el uso de la expresión … Un ejemplo ampliamente conocido serıa Wikipedia, que opera como una comunidad abierta …",https://riull.ull.es/xmlui/bitstream/handle/915/31784/Encontrarnos%20en%20la%20virtualidad%20la%20creacion%20de%20espacios%20%28mas%29%20seguros%20en%20internet%20desde%20una%20perspectiva%20%28trans%29feminista%20e%20interseccional..pdf?sequence=1,,Art+Feminism,TRUE,TRUE,443,,0,0,0
4,MA Kohl,"Vokale Performancekunst als feministische Praxis: Meredith Monk und das künstlerische Kräftefeld in Downtown New York, 1964-1979",2015,,degruyter.com,https://www.degruyter.com/document/doi/10.1515/9783839432235-ref/html,"https://scholar.google.com/scholar?cites=16982117511628364164&as_sdt=2005&sciodt=0,5&hl=en",444,12/23/24 20:52,BOOK,10.1515/9783839432235-ref,,,,,,,4,0.44,4,1,9,"… Women in Performance Art: Feminism and Postmodernism, … www 8th http://en.wikipedia.org/wiki/8th_Street_and_St._Mark%27s_Place_%28Manhat tan%29. Letzter Zugriff: 18.09.2013. …",,,Art+Feminism,FALSE,,444,,0,0,0
0,ML Aguirre,Recortes y música punk contra el canon de belleza en el videoarte feminista vasco,2023,ASRI: Arte y sociedad. Revista de investigación,dialnet.unirioja.es,https://dialnet.unirioja.es/servlet/articulo?codigo=9063729,,445,12/23/24 20:52,,,,,,,,,0,0,0,1,1,"… Anteriormente, fue investigadora principal del proyecto ""Emartistak 2000- 2020: Análisis de la presencia de las artistas vascas en Wikipedia e intervención para su visibilidad"" …",https://dialnet.unirioja.es/descarga/articulo/9063729.pdf,,Art+Feminism,FALSE,,445,,0,0,0
17,JK Brodsky,"Dismantling the Patriarchy, Bit by Bit",2021,,torrossa.com,https://www.torrossa.com/it/resources/an/5203772,"https://scholar.google.com/scholar?cites=2306750604490922378&as_sdt=2005&sciodt=0,5&hl=en",446,12/23/24 20:52,,,,,,,,,17,5.67,17,1,3,"The second is Dr. Ferris Olin, also, like me, a retired Rutgers professor, who has been my longtime collaborator in feminist art. We did one of the first projects to focus on documenting …",,,Art+Feminism,FALSE,,446,,0,0,0
0,J Antivilo,Laboratorio curatorial feminista,2023,Latin American and Latinx Visual Culture,online.ucpress.edu,https://online.ucpress.edu/lalvc/article-abstract/5/2/117/195954,,447,12/23/24 20:52,,,,,,,,,0,0,0,1,1,"Este ‘diálogos’ toma como punto de partida la exposición Mujeres radicales: arte latinoamericano, 1960-1985 (2017-18) para debatir sobre el arte latinoamericano actual, abordando …",,,Art+Feminism,FALSE,,447,,0,0,0
0,T Arslan,PERFORMATİVİTE VE KADIN SANATÇI BEDENİNDE ÇİFTE-YABANCILIK: NEZAKET EKİCİ'NİN PERFORMANS SANATINDA KADIN BEDENİ VE KÜLTÜREL …,,Sanat Yazıları,dergipark.org.tr,https://dergipark.org.tr/tr/doi/10.61742/sanatyazilari.1326339,,448,12/23/24 20:52,,10.61742/sanatyazilari.1326339,,,,,,,0,0,0,1,,"Performans sanatında, sosyal performansları ve toplumsal söylem tarafından dayatılan yanılsamalı öznellik formlarını karşı-gösterge ile sunan sanatçı bedeni, normları zorladığı için …",https://dergipark.org.tr/en/download/article-file/3259475,,Art+Feminism,FALSE,,448,,0,0,0
0,"MA Lezama, ML Ise",Autoetnografía a dos voces: el potencial crítico de nuestras prácticas artísticas-académicas-feministas,2021,… EL VOLCÁN. REVISTA DEL POSGRADO DE …,apps.buap.mx,http://www.apps.buap.mx/ojs3/index.php/bevol/article/view/2256,,449,12/23/24 20:52,,,,,,,,,0,0,0,2,3,"… ciudades (Ciudad de México, Santiago de Chile, Buenos Aires y Córdoba, por ejemplo), que consiste en aprender a editar y cargar los datos de distintas mujeres artistas en Wikipedia. …",http://www.apps.buap.mx/ojs3/index.php/bevol/article/download/2256/1843,,Art+Feminism,FALSE,,449,,0,0,0
0,"遠藤麻衣, エンドウマイ",「フェミニスト」 から 「蛇」 へ 表象と物語を演じる複合的実践の研究,2021,,geidai.repo.nii.ac.jp,https://geidai.repo.nii.ac.jp/record/1474/files/hakuon652_full.pdf,,450,12/23/24 20:52,PDF,,,,,,,,0,0,0,2,3,"… 36 同,19⾴ 37 同,24⾴ 38 同,26⾴ 39 こ の よ う な 偏 っ た 定 義に対する 試 み と し て , 近 年 Wikipedia の フ ェ ミ ニ ズ ム 項⽬へ の書き 換 え ,「美術史を書き 換えよ う ! 2018 …",https://geidai.repo.nii.ac.jp/record/1474/files/hakuon652_full.pdf,,Art+Feminism,FALSE,,450,,FALSE,0,0
0,MF Smith,DEJAR EL LIENZO Y PONER EL CUERPO: NANCY GEWÖLB,,academia.edu,,https://www.academia.edu/download/107263890/libroV1_compressed.pdf,,451,12/23/24 20:52,PDF,,,,,,,,0,0,0,1,,"Ser artista en el mundo es complejo. Ser artista mujer es, además, otra piedra en el camino, dado que el canon de la tradición artística, que por cierto es masculino, ha dificultado que …",https://www.academia.edu/download/107263890/libroV1_compressed.pdf,,Art+Feminism,FALSE,,451,,0,0,0
6,"A Metropolü, DB Kent, RB Fuller, R Venturi",Ekim 2018,,25,academia.edu,https://www.academia.edu/download/62280946/324_ARMIM_EKIM_2018_-_TOPLUMSAL_CINSIYET20200305-58042-c0sdy6.pdf,"https://scholar.google.com/scholar?cites=18365530056417411616&as_sdt=2005&sciodt=0,5&hl=en",452,12/23/24 20:52,PDF,,,,,,,,6,0,2,4,,"44 Mimarlık Kolektivitenin Peşinde: ENOTA Ljubljana, Slovenya 1998’de Aljoša Dekleva, Dean Lah ve Milan Tomac tarafından kurulan Ljubljana merkezli mimarlık ofisi 2002’den bu …",https://www.academia.edu/download/62280946/324_ARMIM_EKIM_2018_-_TOPLUMSAL_CINSIYET20200305-58042-c0sdy6.pdf,,Art+Feminism,FALSE,,452,,0,0,0
4,P Oliva Barboza,Archivo diverso Costa Rica parte 2: Pinceladas de arte con diversidad,2020,Revista Rupturas,scielo.sa.cr,https://www.scielo.sa.cr/scielo.php?script=sci_arttext&pid=S2215-24662020000200143,"https://scholar.google.com/scholar?cites=8421856525834782575&as_sdt=2005&sciodt=0,5&hl=en",453,12/23/24 20:52,HTML,,,,,,,,4,1,4,1,4,"Si existiera un ejercicio constante, que registre las expresiones de arte diverso en el país, notaríamos su relevancia y el aumento de este tipo de creaciones artísticas. El objetivo de …",https://www.scielo.sa.cr/scielo.php?script=sci_arttext&pid=S2215-24662020000200143,,Art+Feminism,FALSE,,453,,0,0,0
3,O Cerrillo Garnica,Rap against rape: hiphop como denuncia a la violencia de género en Ecatepec,2021,Pensamiento palabra y obra,scielo.org.co,http://www.scielo.org.co/scielo.php?pid=S2011-804X2021000200032&script=sci_arttext,"https://scholar.google.com/scholar?cites=16398479282556944320&as_sdt=2005&sciodt=0,5&hl=en",454,12/23/24 20:52,HTML,,,,,,,,3,1,3,1,3,"México se ha convertido en uno de los países más peligrosos del mundo en términos de violencia de género. En años recientes, la notoriedad pública de los movimientos feministas …",http://www.scielo.org.co/scielo.php?pid=S2011-804X2021000200032&script=sci_arttext,,Art+Feminism,FALSE,,454,,0,0,0
0,"SC Pesántez Urgilés, JV Morocho Cabzaca",Protesta contra el femicidio y la violencia de género por medios artísticos en la red y espacios públicos,2016,,dspace.ucuenca.edu.ec,https://dspace.ucuenca.edu.ec/items/ce912f8a-be1a-4e17-88c9-ab8c5f8c5281,,455,12/23/24 20:52,,,,,,,,,0,0,0,2,8,"The present work has as main motivation to merge art with activism, more specifically Applied Art with Illustrative Art (digital) and cyber activism, our primary objective is to create …",https://dspace.ucuenca.edu.ec/bitstreams/4bd36c39-9654-4c6b-bb43-20fbe8d218d9/download,,Art+Feminism,FALSE,,455,,0,0,0
0,SV Arias,Mujeres Artistas Plásticas y Visuales de México en el siglo XX. Una aproximación al arte regional y de género,2021,"EMBLECAT, Estudis de la Imatge, Art i …",publicacions.emblecat.com,https://publicacions.emblecat.com/EMBLECAT/article/view/184,,456,12/23/24 20:52,,,,,,,,,0,0,0,1,3,"El present estudi té com a finalitat fer visible, reconèixer i valorar el desenvolupament professional de les dones artistes del segle XX a l’Estat de Guanajuato. Mèxic. Sintetitza la …",https://publicacions.emblecat.com/EMBLECAT/article/download/184/186,,Art+Feminism,FALSE,,456,,0,0,0
0,W El Younoussi Zriki,Tres artistes de l'Àfrica mediterrània en les primeres avantguardes europees,2023,,diposit.ub.edu,https://diposit.ub.edu/dspace/handle/2445/202287,,457,12/23/24 20:52,,,,,,,,,0,0,0,1,1,L'objectiu principal d'aquest treball és realitzar una investigació exhaustiva sobre tres dones artistes que van influir en el context artístic de les Primeres Avantguardes d’origen europeu …,https://diposit.ub.edu/dspace/bitstream/2445/202287/1/TFG_El_Younoussi_Zriki_Wissal.pdf,,Art+Feminism,FALSE,,457,,0,0,0
4,R Derdiyok,Çizgi romanlarda kadın karakterlerin nesneleştirilmesi üzerinekarşılaştırmalı bir inceleme ve bir çizgi roman uygulaması,2019,,acikbilim.yok.gov.tr,https://acikbilim.yok.gov.tr/handle/20.500.12812/435840,"https://scholar.google.com/scholar?cites=12720333111740879221&as_sdt=2005&sciodt=0,5&hl=en",458,12/23/24 20:52,,,,,,,,,4,0.8,4,1,5,"Çizgi roman, kitap ve film senaryolarında kadın karakterler, geleneksel feminist kuram ile incelendiğinde, erkek izleyicinin zevkine uygun olarak ve inandırıcı olmayan bir biçimde …",https://acikbilim.yok.gov.tr/bitstream/handle/20.500.12812/435840/yokAcikBilim_10235777.pdf?sequence=-1,,Art+Feminism,FALSE,,458,,0,0,0
0,Β Κούρτη,Σύγχρονο φεμινιστικό κίνημα: τα αιτήματα οι διεκδικήσεις και οι μεταλλάξεις του από το 1960 έως σήμερα: η συστράτευση τέχνης και ψηφιακής τεχνολογίας.,2023,,hellanicus.lib.aegean.gr,https://hellanicus.lib.aegean.gr/handle/11610/26718,,459,12/23/24 20:52,,,,,,,,,0,0,0,1,1,"Η πορεία της σχέσης του φύλου με την τέχνη δεν αντιμετωπίζονταν ως ξεχωριστό αντικείμενο μελέτης πριν την ανάδειξή του, από το φεμινιστικό κίνημα στο πλαίσιο της αμερικανικής και …",https://hellanicus.lib.aegean.gr/bitstream/handle/11610/26718/%CE%A6%CE%95%CE%9C%CE%99%CE%9D%CE%99%CE%A3%CE%9C%CE%9F%CE%A3-%CE%A4%CE%95%CE%A7%CE%9D%CE%97-%CE%A4%CE%95%CE%A7%CE%9D%CE%9F%CE%9B%CE%9F%CE%93%CE%99%CE%91pdf.pdf?sequence=1&isAllowed=y,,Art+Feminism,,,459,,0,0,Β_Κούρτη_Σύγχρονο_φεμινιστικό_κίνημα_τα_αιτήματα_οι_διεκδικήσεις_και_οι_μεταλλάξεις_του_από_το_1960_έως_σήμερα_η_συστράτευση_τέχνης_και_ψηφιακής_τεχνολογίας..pdf
5,D Kozlu,Bedenini sanat nesnesi olarak kullanan kadın sanatçıların sosyolojik açıdan irdelenmesi,2008,,search.proquest.com,https://search.proquest.com/openview/961cbe8db15fbf3b143a7793de417243/1?pq-origsite=gscholar&cbl=2026366&diss=y&casa_token=3g3scsTmJpgAAAAA:V_Sdzb2eTv3REjYufUQ9-pvAMyzgS0B1HHZjNnQ43JMZyvpmHYrIBWIIEvjw2009T2JKMrpwhg,"https://scholar.google.com/scholar?cites=6197757773423467502&as_sdt=2005&sciodt=0,5&hl=en",460,12/23/24 20:52,HTML,,,,,,,,5,0.31,5,1,16,Sosyal yapıların sürekli değişen formlarının algılanışı ve bu yapılar içinde çeşitli grupların bu değişim için yaptıkları katkılar şüphesiz tartışılmaz. Kadınlarda bu gruplardan biri olarak bu …,https://search.proquest.com/openview/961cbe8db15fbf3b143a7793de417243/1?pq-origsite=gscholar&cbl=2026366&diss=y&casa_token=3g3scsTmJpgAAAAA:V_Sdzb2eTv3REjYufUQ9-pvAMyzgS0B1HHZjNnQ43JMZyvpmHYrIBWIIEvjw2009T2JKMrpwhg,,Art+Feminism,FALSE,FALSE,460,,0,0,0
0,S Boussetat,La Formule Wikipédia,2024,,torrossa.com,https://www.torrossa.com/gs/resourceProxy?an=5751702&publisher=FZ9823,,461,12/23/24 20:52,,,,,,,,,0,0,0,1,1,"… L’alliance non seulement du wiki mais également du logiciel libre, sur lequel nous reviendrons plus tard, vont donc permettre à Wikipédia l’incroyable exploit de réinventer le genre …",,,Art+Feminism,FALSE,,461,,0,0,0
0,L García Molinero,No (s) tenemos: prácticas artístico-educativas feministas y bienestar universitario,2024,,docta.ucm.es,https://docta.ucm.es/entities/publication/99d04ea7-886c-44e7-917b-63094cb66abe,,462,12/23/24 20:52,,,,,,,,,0,0,0,1,1,"… This approach, made from a theoretical perspective, began with the definition of general frameworks such as the relations between education-feminism and art-feminism. Later on, it …",https://docta.ucm.es/bitstreams/9423df1e-f80c-4f8e-bcdf-ee26eb933dbe/download,,Art+Feminism,FALSE,,462,,0,0,0
0,AE Torstveit,"Hvordan ble kvinnekroppen brukt som formidler i performancekunsten på 1960 og 1970-tallet? En analyse av performancene Meat Joy, Interior Scroll, Lips of Thomas …",2021,,ntnuopen.ntnu.no,https://ntnuopen.ntnu.no/ntnu-xmlui/handle/11250/2776686,,463,12/23/24 20:52,,,,,,,,,0,0,0,1,3,I denne masteroppgaven svarer jeg på problemstillingen «Hvordan ble kvinnekroppen brukt som formidler i performancekunsten på 1960 og 1970-tallet»? Dette gjør jeg ved å …,https://ntnuopen.ntnu.no/ntnu-xmlui/bitstream/handle/11250/2776686/no.ntnu%3Ainspera%3A76663837%3A50771491.pdf?sequence=1,,Art+Feminism,FALSE,,463,,0,0,0
1,H Yaprak,Güncel sanatta kadın sorunsalının kültürel yansımaları,2017,,acikbilim.yok.gov.tr,https://acikbilim.yok.gov.tr/handle/20.500.12812/581992,"https://scholar.google.com/scholar?cites=15309893696423878621&as_sdt=2005&sciodt=0,5&hl=en",464,12/23/24 20:52,,,,,,,,,1,0.14,1,1,7,"Kadın sorunsalı veya Feminizm son iki yüzyılın en tartışmalı konularından bir olmuştur. Sosyolojik tartışmaların en popüler konusu olarak feminizm, sadece kadının toplumdaki yerini …",https://acikbilim.yok.gov.tr/bitstream/handle/20.500.12812/581992/yokAcikBilim_10126336.pdf?sequence=-1,,Art+Feminism,FALSE,,464,,0,0,0
0,E Joud,L'expérience de contribution non monétaire,2021,,theses.hal.science,https://theses.hal.science/tel-04127347/,,465,12/23/24 20:52,,,,,,,,,0,0,0,1,3,"… Art + Feminism est une organisation sans but lucratif1 qui vise à lutter contre un biais de … -binaires, transsexuelles ou racisées dans les encyclopédies Wikipédia et ses projets annexes (…",https://theses.hal.science/tel-04127347/document,,Art+Feminism,TRUE,TRUE,465,,0,0,0
0,S Mercieca,Kultura Ħarġa# 3,2019,,um.edu.mt,https://www.um.edu.mt/library/oar/bitstream/123456789/50007/1/Kultura_%C4%A7ar%C4%A1a_3.PDF,,466,12/23/24 20:52,PDF,,,,,,,,0,0,0,1,5,"Kultura Harga # 3 Page 1 Page 2 www.expressgroup.com It's Your Business #WeAreOrange Follow our story IJ@JO But whatever your activity, you would want to reduce business and …",https://www.um.edu.mt/library/oar/bitstream/123456789/50007/1/Kultura_%C4%A7ar%C4%A1a_3.PDF,,Art+Feminism,FALSE,,466,,0,0,0
