Cites,Authors,Title,Year,Source,Publisher,ArticleURL,CitesURL,GSRank,QueryDate,Type,DOI,ISSN,CitationURL,Volume,Issue,StartPage,EndPage,ECC,CitesPerYear,CitesPerAuthor,AuthorCount,Age,Abstract,FullTextURL,RelatedURL,Term,Mandiberg,Is Term,Original Sort Order,Check Fulltext,Type,Project,local_filename,special
0,"NB Thylstrup, D Agostinho, KE Veel…","Infrapolitics, Archival infrastructures and Digital Reparative Practices",2024,… Interventions in Praxis,tu-dresden.de,https://tu-dresden.de/gsw/ressourcen/dateien/genderconceptgroup/veranstaltungen-der-gcg/20201203_Thylstrup-et-al.pdf,,148,12/23/24 20:52,PDF,,,,,,,,0,0,0,4,1,"… articles and other media on Wikipedia. Art+Feminism particularly strives towards an adequate … of color, and Indigenous communities in the writing and editing of Wikipedia. Moreover, …",https://tu-dresden.de/gsw/ressourcen/dateien/genderconceptgroup/veranstaltungen-der-gcg/20201203_Thylstrup-et-al.pdf,,Art+Feminism,TRUE,TRUE,148,,0,0,0
1,R O'Neill,Museums and Participatory Culture: Wikimedia and GLAM,2020,Museums and the Challenge of Change,taylorfrancis.com,https://www.taylorfrancis.com/chapters/edit/10.4324/9781003043010-6/museums-participatory-culture-rebecca-neill,"https://scholar.google.com/scholar?cites=3228812542804873908&as_sdt=2005&sciodt=0,5&hl=en",149,12/23/24 20:52,,10.4324/9781003043010-6,,,,,,,1,0.25,1,1,4,"… For some in cultural institutions, Wikipedia and its sister … These fears are in spite of the fact that Wikipedia, at the time … a particular campaign, such as Art+Feminism. Since the inception of …",,,Art+Feminism,TRUE,TRUE,149,,0,Art+Feminism,R_ONeill_Museums_and_Participatory_Culture_Wikimedia_and_GLAM.pdf
0,"J Mwaura, C Mwaura",Echoes of Endurance: Reviving Kenya's Vanishing Voices and Visions,,openreview.net,,https://openreview.net/pdf?id=hQxmwRJUP4,,150,12/23/24 20:52,PDF,,,,,,,,0,0,0,2,,"… Her involvement in projects like Wiki Loves Women and Art+Feminism and her role in community engagement and project management enhances her suitability for the project, …",https://openreview.net/pdf?id=hQxmwRJUP4,,Art+Feminism,TRUE,TRUE,150,,0,0,0
0,"AM Furness, P Poletto",Extending the Conversation: Art Gallery of Ontario Artists in Residence and the Edward P. Taylor Library &Archives,2024,International Journal of Librarianship,journal.calaijol.org,https://journal.calaijol.org/index.php/ijol/article/view/364,,151,12/23/24 20:52,,,,,,,,,0,0,0,2,1,"… The AGO’s first Art + Feminism Wikipedia edit-a-thon took … The goals and values of the Art+Feminism project were well … around the event, the Art+Feminism project was only a year old in …",https://journal.calaijol.org/index.php/ijol/article/download/364/413,,Art+Feminism,TRUE,TRUE,151,,0,0,0
0,C Kwok,Tagged race,,jitp.commons.gc.cuny.edu,,https://jitp.commons.gc.cuny.edu/tag/race/,,152,12/23/24 20:52,HTML,,,,,,,,0,0,0,1,,"… Indeed, these thoughtful components at the Art + Feminism Edit-A-Thon event I attended a … intellectually stimulating experience when I approached Wikipedia as a volunteer writer for …",https://jitp.commons.gc.cuny.edu/tag/race/,,Art+Feminism,TRUE,TRUE,152,,0,0,0
2,"N Ratković, P Jerchel, PY Hsing…",Wikipedia and Its Sister Projects as Important Elements of the Teaching and Learning Process–a Review of the Global Situation,2020,Łódzkie Studia …,bibliotekanauki.pl,https://bibliotekanauki.pl/articles/1200473.pdf,"https://scholar.google.com/scholar?cites=5616668291095443501&as_sdt=2005&sciodt=0,5&hl=en",153,12/23/24 20:52,PDF,,,,,,,,2,0.5,1,4,4,The article presents the general idea of Wikimedia education and the situation of educational programs based on Wiki(p)media tools and capabilities in four countries. …,https://bibliotekanauki.pl/articles/1200473.pdf,,Art+Feminism,TRUE,,153,,mention,0,0
0,R O'Neill,MUSEUMS AND PARTICIPATORY CULTURE,2020,Museums and the Challenge of Change: Old …,books.google.com,https://books.google.com/books?hl=en&lr=&id=-KoLEAAAQBAJ&oi=fnd&pg=PT47&dq=%22art+feminism%22+wikipedia&ots=r-IpKvgHBT&sig=mndRO8emkV87JYgmhjRZGokn1-I,,154,12/23/24 20:52,,,,,,,,,0,0,0,1,4,"… For some in cultural institutions, Wikipedia and its sister … These fears are in spite of the fact that Wikipedia, at the time of … particular campaign, such as Art+ Feminism. Since the inception …",,,Art+Feminism,TRUE,TRUE,154,,0,0,0
0,"M Lemieux, R Zhang, F Tripodi",“Too Soon” To Count? The impact of gender and race on perceived notability,,wikiworkshop.org,,https://wikiworkshop.org/2022/papers/WikiWorkshop2022_paper_15.pdf,,155,12/23/24 20:52,PDF,,,,,,,,0,0,0,3,,"… nominated for deletion, we demonstrate how Wikipedia’s notability criteria are unequally … groups, like Women in Red and Art+Feminism. Wikipedia editing events aim to inspire new …",https://wikiworkshop.org/2022/papers/WikiWorkshop2022_paper_15.pdf,,Art+Feminism,TRUE,TRUE,155,,0,0,0
0,"B River, M Man, B Star",Friendly Correspondence,,digitalcommons.otterbein.edu,,https://digitalcommons.otterbein.edu/cgi/viewcontent.cgi?article=1043&context=friends,,156,12/23/24 20:52,PDF,,,,,,,,0,0,0,3,,… a Wikipedia Edit-a-Thon around the themes of Art + Feminism. Attendees were taught the basics of how to edit a Wikipedia … Art + Feminism is a nationwide campaign that takes place …,https://digitalcommons.otterbein.edu/cgi/viewcontent.cgi?article=1043&context=friends,,Art+Feminism,TRUE,TRUE,156,,0,0,0
3,N Ferran-Ferrer…,Wikipedia gender gap: a scoping review,2023,Profesional de …,revista.profesionaldelainformacion …,https://revista.profesionaldelainformacion.com/index.php/EPI/article/view/87476,"https://scholar.google.com/scholar?cites=11828479822415477224&as_sdt=2005&sciodt=0,5&hl=en",157,12/23/24 20:52,,,,,,,,,3,3,2,2,1,"… In this scoping review, we portray an examination of the gender gap on Wikipedia by analyzing scholarly literature from 2007 to 2022. Employing quantitative methods, the study …",https://revista.profesionaldelainformacion.com/index.php/EPI/article/download/87476/63566,,Art+Feminism,FALSE,,157,,0,0,0
0,C Wolifson,"Patriotism, patriarchy and politics",2015,Art Monthly Australia,search.informit.org,https://search.informit.org/doi/abs/10.3316/informit.609451354328937,,158,12/23/24 20:52,,10.3316/informit.609451354328937,,,,,,,0,0,0,1,9,… This included a reprisal of Art+Feminism’s ‘Wikipedia Edit-athon’ in which contributors seek to redress the gender imbalances within the global information repository. The program took …,https://search.proquest.com/openview/8fb6dc42ec4669990cfdba4286f863b2/1?pq-origsite=gscholar&cbl=886360&casa_token=AY5MuaUshFQAAAAA:K7UBhBq3yTpwnnal5ey9C5wl1u9tVVtdMleaWMIAmW0djnQywyOdZ5_ggrdDjQpx7d1--TFYhw,,Art+Feminism,TRUE,TRUE,158,,0,0,0
0,"N Ferran, JJ Boté-Vericad…",Wikipedia gender gap: a scoping review,2023,Profesional de la …,openaccess.uoc.edu,https://openaccess.uoc.edu/handle/10609/150286,,159,12/23/24 20:52,,,,,,,,,0,0,0,3,1,"… In this scoping review, we portray an examination of the gender gap on Wikipedia by … Overall, this comprehensive review enhances our comprehension of the Wikipedia gender …",https://openaccess.uoc.edu/bitstream/10609/150286/1/Wikipedia_gender_gap_a_scoping_review.pdf,,Art+Feminism,FALSE,,159,,0,0,0
0,RL Kear,Extended Editor's Report: IFLA Notes from Robin Kear,2016,International Information &Library Review,Taylor &Francis,https://www.tandfonline.com/doi/abs/10.1080/10572317.2016.1243971?casa_token=z46CPD6rBVoAAAAA:H2dMoJrK7h28EtY6sZaUW5lt6pmDzfdXQiKvQpoaYOUhxP5OJaPz-BDgjyjojMkKbAUtRu6XcX2ejXE,,160,12/23/24 20:52,,10.1080/10572317.2016.1243971,,,,,,,0,0,0,1,8,… ongoing fruitful cooperation between libraries and Wikipedia. We will highlight some best … Wiki monuments was successful. Wiki loves women campaign and art+feminism to diversify …,https://www.tandfonline.com/doi/pdf/10.1080/10572317.2016.1243971?casa_token=6s-BsONRiOcAAAAA:Aam-VuWlNSFYcphBljvpjdaQAUAUi5-TWmU8Z7yIw2u7PBGoZ5iGCQF6iKLjuBD_xNnjDsb3VX4u1oc,,Art+Feminism,FALSE,TRUE,160,,FALSE,,RL_Kear_Extended_Editors_Report_IFLA_Notes_from_Robin_Kear.pdf
27,"A Halfaker, D Taraborelli",Artificial intelligence service “ORES” gives Wikipedians X-ray specs to see through bad edits,2015,Wikimedia Blog,wikimediafoundation.org,https://wikimediafoundation.org/news/2015/11/30/artificial-intelligence-x-ray-specs/,"https://scholar.google.com/scholar?cites=13873892059155172843&as_sdt=2005&sciodt=0,5&hl=en",161,12/23/24 20:52,HTML,,,,,,,,27,3,14,2,9,"… Wikipedia is edited about half a million times per day. In order to maintain the quality of Wikipedia, … quality control in Wikipedia more transparent, auditable, and easy to experiment with. …",https://wikimediafoundation.org/news/2015/11/30/artificial-intelligence-x-ray-specs/,,Art+Feminism,FALSE,,161,,0,0,0
0,M Balinska,Library Perspectives,2018,Perspectives,oberlin.edu,https://www2.oberlin.edu/library/friends/perspectives/perspectives59.pdf,,162,12/23/24 20:52,PDF,,,,,,,,0,0,0,1,6,"… joint Art+Feminism Wikipedia Edit-AThon. Part of the larger international Art+Feminism campaign, … identities and expressions how to edit Wikipedia content, Oberlin College joined many …",https://www2.oberlin.edu/library/friends/perspectives/perspectives59.pdf,,Art+Feminism,TRUE,TRUE,162,,0,0,0
2,T Sant,How Can Wikipedia Save Us all?: Assuming Good Faith from all Points of View in the Age of Fake News and Post-truth,2021,"Media, Technology and Education in a Post-Truth …",emerald.com,https://www.emerald.com/insight/content/doi/10.1108/978-1-80043-906-120211010,"https://scholar.google.com/scholar?cites=8400262581071815207&as_sdt=2005&sciodt=0,5&hl=en",163,12/23/24 20:52,,10.1108/978-1-80043-906-120211010,,,,,,,2,0.67,2,1,3,"… students and teachers how to edit Wikipedia. Ostensibly we encouraged students to write Wikipedia rather than cite Wikipedia. “Don't cite Wikipedia, write Wikipedia” was indeed one of …",,,Art+Feminism,FALSE,,163,,0,0,0
2,"A Duncan, V Eades-Miller, A Ramejkis",Opening Spaces for Creative and Critical Enquiry,,Narrative Expansions: Interpreting …,cambridge.org,https://www.cambridge.org/core/services/aop-cambridge-core/content/view/4270DD4CC6A112CB5EEB3814E5CDB447/stamped-9781783304998c10_p139-152_CBO.pdf/opening-spaces-for-creative-and-critical-enquiry.pdf,"https://scholar.google.com/scholar?cites=6388076740209491068&as_sdt=2005&sciodt=0,5&hl=en",164,12/23/24 20:52,,,,,,,,,2,0,1,3,,"… Wikipedia Art+Feminism edit-a-thons, a sense they were the sort of thing librarians ought to be doing. The statistics on the Art+Feminism organisation website (Art+Feminism, … Wikipedia …",,,Art+Feminism,TRUE,TRUE,164,,0,Art+Feminism,A_Duncan__V_Eades-Miller__A_Ramejkis_Opening_Spaces_for_Creative_and_Critical_Enquiry.pdf
1,K Kennedy,Wikipedians among Us: From Allies to Reformers,2021,"She Ji: The Journal of Design, Economics, and …",Elsevier,https://www.sciencedirect.com/science/article/pii/S2405872621000332,"https://scholar.google.com/scholar?cites=16106573533026779007&as_sdt=2005&sciodt=0,5&hl=en",165,12/23/24 20:52,HTML,,,,,,,,1,0.33,1,1,3,"… Part of the annual Art+Feminism international edit… Wikipedia. Hearing about its success made me less nervous about later going to one myself, targeted at women, run by local Wikipedia …",https://www.sciencedirect.com/science/article/pii/S2405872621000332,,Art+Feminism,TRUE,TRUE,165,,0,Art+Feminism,K_Kennedy_Wikipedians_among_Us_From_Allies_to_Reformers.pdf
0,"M Centelles, N Ferran-Ferrer",Assessing knowledge organization systems from a gender perspective: Wikipedia taxonomy and Wikidata ontologies,2024,Journal of Documentation,emerald.com,https://www.emerald.com/insight/content/doi/10.1108/JD-11-2023-0230/full/html,,166,12/23/24 20:52,HTML,10.1108/JD-11-2023-0230,,,,,,,0,0,0,2,1,"… This study employs heuristic and inspection methods to assess Wikipedia’s KOS, ensuring … properties, comparing them to Wikipedia’s taxonomy for advantages and enhancements. …",https://www.emerald.com/insight/content/doi/10.1108/JD-11-2023-0230/full/html,,Art+Feminism,FALSE,,166,,0,0,0
2,EJ Kelly,Assessing Impact of Medium-Sized Institution Digital Cultural Heritage on Wikimedia Projects,2019,Journal of Contemporary Archival Studies,elischolar.library.yale.edu,https://elischolar.library.yale.edu/jcas/vol6/iss1/25/,"https://scholar.google.com/scholar?cites=11108390534197708325&as_sdt=2005&sciodt=0,5&hl=en",167,12/23/24 20:52,,,,,,,,,2,0.4,2,1,5,"… , in which groups of new and seasoned Wikipedia editors converge and attempt to improve … “gendered activism,” such as the annual art+feminism wiki edit-athon events.However, these …",https://elischolar.library.yale.edu/cgi/viewcontent.cgi?article=1101&context=jcas,,Art+Feminism,TRUE,TRUE,167,,0,0,0
0,"KT Huq, GL Ciampaglia",Survival of the Notable: Gender Asymmetry in Wikipedia Collective Deliberations,2024,arXiv preprint arXiv:2411.04340,arxiv.org,https://arxiv.org/abs/2411.04340,,168,12/23/24 20:52,,,,,,,,,0,0,0,2,1,"… on Wikipedia and its community. We then provide a brief description of how the Wikipedia … Aside from Women in Red, several other feminist movements like “Art + Feminism” and “500 …",https://arxiv.org/pdf/2411.04340,,Art+Feminism,TRUE,TRUE,168,,0,0,0
0,C DONATIONS,SAY WHAT?,,search.proquest.com,,https://search.proquest.com/openview/0900f547d4cb86480596c38f2c92bb3f/1?pq-origsite=gscholar&cbl=106011,,169,12/23/24 20:52,,,,,,,,,0,0,0,1,,… Art+Feminism’s annual Wikipedia edit-a-thon comes to the … Wikipedia so that the group can rectify the omission of female contributions to art history in the received canon that Wikipedia …,,,Art+Feminism,TRUE,TRUE,169,,0,Art+Feminism,C_DONATIONS_SAY_WHAT.pdf
1,"P De Montfort, RE Calvert",Still Invisible?,2016,British Art Studies,search.ebscohost.com,https://search.ebscohost.com/login.aspx?direct=true&profile=ehost&scope=site&authtype=crawler&jrnl=20585462&asa=N&AN=118419088&h=JI4sCAcx8Bz6w%2BFlyQxZttZ3Dv7BsVT0EKYiUJQ7Ea1RL6LOuCcdC9BASmAuZQuynyOBcTKCsV%2FJgx9SlhrYcQ%3D%3D&crl=c,"https://scholar.google.com/scholar?cites=1739551294287583153&as_sdt=2005&sciodt=0,5&hl=en",170,12/23/24 20:52,,,,,,,,,1,0.13,1,2,8,"… by Art+Feminism. Their mission is to increase coverage of women and the arts on Wikipedia, … Yale’s Art+Feminism Edit-a-thon focused on bringing attention to women artists associated …",,,Art+Feminism,TRUE,TRUE,170,,0,Art+Feminism,P_De_Montfort__RE_Calvert_Still_Invisible.pdf
0,"C BARON, O ECKERT",The Kentucky Women Artists Timeline: THE UOFL MARGARET M. BRIDWELL ART LIBRARY AND THE KENTUCKY FOUNDATION FOR WOMEN COLLABORATE TO …,2021,Kentucky Libraries,search.ebscohost.com,https://search.ebscohost.com/login.aspx?direct=true&profile=ehost&scope=site&authtype=crawler&jrnl=07325452&AN=152324739&h=TPzrQ29m92xS0pDrB2eYsk6geGdE4Su2FllQr1oAnL0%2B3%2BqYvFafuLqVQ8WlXAaqqBaPf1CzANY0b%2BlsYUwfww%3D%3D&crl=c,,171,12/23/24 20:52,,,,,,,,,0,0,0,2,3,… The nonprofit Art+Feminism has led the way in closing gaps … Data analysis tools have shown that Wikipedia contains … articles on Wikipedia through events sponsored by Art+Feminism. …,,,Art+Feminism,TRUE,TRUE,171,,0,Art+Feminism,C_BARON__O_ECKERT_The_Kentucky_Women_Artists_Timeline_THE_UOFL_MARGARET_M._BRIDWELL_ART_LIBRARY_AND_THE_KENTUCKY_FOUNDATION_FOR_WOMEN_COLLABORATE_TO_....pdf
4,L Appleton,Is critical art librarianship actually a thing?,2019,Art libraries journal,cambridge.org,https://www.cambridge.org/core/journals/art-libraries-journal/article/viewpoint-is-critical-art-librarianship-actually-a-thing/9C6F17C3A81E7B0F00047EBD086E2DD7,"https://scholar.google.com/scholar?cites=11994142322261168918&as_sdt=2005&sciodt=0,5&hl=en",172,12/23/24 20:52,,,,,,,,,4,0.8,4,1,5,"… as Art +Feminism’s Wikipedia edit-a-thons16 to teaching critical information literacy through a variety of creative outlets such as object based learning, which by its nature inherently …",https://eprints.whiterose.ac.uk/166583/7/Is%20critical%20arts%20librarianship%20actually%20a%20thing%20accepted%20manuscript.pdf,,Art+Feminism,TRUE,TRUE,172,,0,0,0
5,"ZJ McDowell, MD Stewart",Student learning outcomes with Wikipedia-based assignments,2019,The International Journal of …,ijoer.scholasticahq.com,https://ijoer.scholasticahq.com/article/25055.pdf,"https://scholar.google.com/scholar?cites=10314862450553324711&as_sdt=2005&sciodt=0,5&hl=en",173,12/23/24 20:52,PDF,,,,,,,,5,1,3,2,5,"… ceptions of Wikipedia positively change after having edited Wikipedia. … Wikipedia, their perception shifted through completing the Wikipedia assignment to show more trust in Wikipedia …",https://ijoer.scholasticahq.com/article/25055.pdf,,Art+Feminism,FALSE,,173,,FALSE,0,0
6,A Lockett,The traditional research paper is best,2017,BAD IDEAS,textbooks.lib.wvu.edu,http://textbooks.lib.wvu.edu/badideas/badideasaboutwriting-book.pdf#page=247,"https://scholar.google.com/scholar?cites=9157525941329292888&as_sdt=2005&sciodt=0,5&hl=en",174,12/23/24 20:52,PDF,,,,,,,,6,0.86,6,1,7,"… source, collaborative archives like Wikipedia, which models an … Wikipedia edit-a-thons sponsored by Art+ Feminism. Research 2.0—be it delivered through a paper, ePortfolio, Wikipedia…",http://textbooks.lib.wvu.edu/badideas/badideasaboutwriting-book.pdf#page=247,,Art+Feminism,TRUE,TRUE,174,,0,0,0
0,"A Ramejkis, V Eades-Miller, A Duncan",Opening Spaces for Creative and Critical Enquiry,2021,,ualresearchonline.arts.ac.uk,https://ualresearchonline.arts.ac.uk/id/eprint/17542/1/opening%20spaces%20for%20creative%20and%20critical%20inquiry.pdf,,175,12/23/24 20:52,PDF,,,,,,,,0,0,0,3,3,"… Wikipedia Art + Feminism edit-a-thons, a sense they were the sort of thing librarians ought to be doing. The statistics on the Art+Feminism organisation website (Art+Feminism… Wikipedia, …",https://ualresearchonline.arts.ac.uk/id/eprint/17542/1/opening%20spaces%20for%20creative%20and%20critical%20inquiry.pdf,,Art+Feminism,TRUE,TRUE,175,,0,Art+Feminism,A_Duncan__V_Eades-Miller__A_Ramejkis_Opening_Spaces_for_Creative_and_Critical_Enquiry.pdf
0,AJ Chou,Analyzing Wikipedia Citation Quality at Scale via Productionization of Machine Learning Models,2020,,search.proquest.com,https://search.proquest.com/openview/67e0bff3bb7f63e633d81b4832b2ed6f/1?pq-origsite=gscholar&cbl=2026366&diss=y&casa_token=Bo33In-EzqUAAAAA:OPv0QNLw_kxQ_c9es2yQasHRBcynCWhBX-nugvI-lA54mBu1ZJyZ5bRkJtFRaGIxF8T4OVQHcw,,176,12/23/24 20:52,HTML,,,,,,,,0,0,0,1,4,… Wikipedia. Women's biographies and Africa-related articles are also well-sourced in Wikipedia with … countries are poorly sourced in English Wikipedia as the availability of sources may …,https://search.proquest.com/openview/67e0bff3bb7f63e633d81b4832b2ed6f/1?pq-origsite=gscholar&cbl=2026366&diss=y&casa_token=Bo33In-EzqUAAAAA:OPv0QNLw_kxQ_c9es2yQasHRBcynCWhBX-nugvI-lA54mBu1ZJyZ5bRkJtFRaGIxF8T4OVQHcw,,Art+Feminism,FALSE,,176,,0,0,0
0,"E Covington, D Arbino, G Bastone, E Gerberich…",DAC Blog 2021-03,2021,,repositories.lib.utexas.edu,https://repositories.lib.utexas.edu/bitstreams/53ca08e4-938d-4867-a6f1-282b905663f8/download,,177,12/23/24 20:52,PDF,,,,,,,,0,0,0,5,3,"… —Queering the Record and Art+Feminism—both aiming to expand the information available on Wikipedia related to queer, trans, and feminist topics. Though Art+Feminism is part of a …",https://repositories.lib.utexas.edu/bitstreams/53ca08e4-938d-4867-a6f1-282b905663f8/download,,Art+Feminism,TRUE,TRUE,177,,0,0,0
2,"A Arora, R West, M Gerlach",Orphan Articles: The Dark Matter of Wikipedia,2024,… of the International AAAI Conference on …,ojs.aaai.org,https://ojs.aaai.org/index.php/ICWSM/article/view/31300,"https://scholar.google.com/scholar?cites=11639939125158428196&as_sdt=2005&sciodt=0,5&hl=en",178,12/23/24 20:52,,,,,,,,,2,2,1,3,1,"… In fact, it has been shown that community-organized campaigns such as Art+Feminism are very successful at improving the content of articles about women; but are less successful at …",https://ojs.aaai.org/index.php/ICWSM/article/download/31300/33460,,Art+Feminism,TRUE,TRUE,178,,0,Art+Feminism,A_Arora__R_West__M_Gerlach_Orphan_Articles_The_Dark_Matter_of_Wikipedia.pdf
40,"J Reagle, J Koerner",Wikipedia@ 20: Stories of an incomplete revolution,2020,,library.oapen.org,https://library.oapen.org/handle/20.500.12657/43467,"https://scholar.google.com/scholar?cites=273402107895124571&as_sdt=2005&sciodt=0,5&hl=en",179,12/23/24 20:52,BOOK,,,,,,,,40,10,20,2,4,"… We include essays from those working to remedy this shortfall, from the Art+Feminism and Black Lunch Table projects, from an educator at a historically Black Women’s college, and …",https://library.oapen.org/bitstream/handle/20.500.12657/43467/external_content.pdf?sequence=1andisAllowed=y,,Art+Feminism,TRUE,TRUE,179,,0,0,0
1,E Bates,The prevalence and origins of contemporary and historic photographs in Wikipedia articles,2017,,cdr.lib.unc.edu,https://cdr.lib.unc.edu/concern/masters_papers/j3860b595,"https://scholar.google.com/scholar?cites=6368504946062223120&as_sdt=2005&sciodt=0,5&hl=en",180,12/23/24 20:52,,,,,,,,,1,0.14,1,1,7,… Cultural heritage institutions are increasingly engaging with Wikipedia to improve its content … historic photographs embedded as illustrations in Wikipedia articles. A random sample of …,https://cdr.lib.unc.edu/downloads/3484zm58q,,Art+Feminism,FALSE,,180,,0,0,0
0,SO Almalik,Mind the Gap: Bridging Wikipedia's “Geographical Gap” for the Global Periphery,2021,,uh-ir.tdl.org,https://uh-ir.tdl.org/items/a8ad4920-9344-4edf-8c0c-6b272fc7b470,,181,12/23/24 20:52,,,,,,,,,0,0,0,1,3,"… Contributions to Wikipedia articles are uneven across the globe in all Wikipedia languages, … representations and proposes that rather than uncritical consumption of Wikipedia’s content, …",https://uh-ir.tdl.org/bitstreams/47bf9452-b354-413d-a339-f3ce23d724b6/download,,Art+Feminism,FALSE,,181,,0,0,0
0,AD Purcell,"IAWA Archivist's Report, 2018",2018,,vtechworks.lib.vt.edu,https://vtechworks.lib.vt.edu/items/2ab3b454-f4cc-482c-ac37-ba55a2330e3b,,182,12/23/24 20:52,,,,,,,,,0,0,0,1,6,"… Rebecca Fitzsimmons and Jade Snelling hosted an Art+Feminism Wikipedia Edit-aThon on March 28, 2018 in collaboration with the VT Women’s Center and the VT Library Open …",https://vtechworks.lib.vt.edu/bitstreams/960ba1a3-527f-4273-87d1-1fec517da75f/download,,Art+Feminism,TRUE,TRUE,182,,0,0,0
1,C Ball,Using Wikipedia to explore issues of systemic bias and symbolic annihilation in information sources,2021,,repository.derby.ac.uk,https://repository.derby.ac.uk/item/92202/using-wikipedia-to-explore-issues-of-systemic-bias-and-symbolic-annihilation-in-information-sources,"https://scholar.google.com/scholar?cites=10601968601846002701&as_sdt=2005&sciodt=0,5&hl=en",183,12/23/24 20:52,,,,,,,,,1,0.33,1,1,3,… increase the number of female subjects in Wikipedia’s biographies (which has improved from 15% to 18% since the project began). Art+Feminism works to improve coverage of articles …,https://repository.derby.ac.uk/download/5a72490d325eb3f5d0fd1d141e674b38a9198af61db632b6a59659a3b47f2278/224562/using%20wikipedia.pdf,,Art+Feminism,TRUE,TRUE,183,,0,0,0
3,L Bollini,Missing in Action,2020,PAD# 19 Communication Design Apart,re.public.polimi.it,https://re.public.polimi.it/retrieve/e6f0740a-e699-4ef5-833b-7746dc32bc8a/%2319-PAD-122020-LOWRES.pdf#page=40,"https://scholar.google.com/scholar?cites=7063623622055043039&as_sdt=2005&sciodt=0,5&hl=en",184,12/23/24 20:52,PDF,,,,,,,,3,0.75,3,1,4,"… Actions like the one undertaken by Art+ Feminism, Wikipedia edit-a-thon become crucial to enrich the landscape and presence, despite the often-fierce controversies. 13 …",https://re.public.polimi.it/retrieve/e6f0740a-e699-4ef5-833b-7746dc32bc8a/%2319-PAD-122020-LOWRES.pdf#page=40,,Art+Feminism,TRUE,TRUE,184,,0,0,0
0,"LF Klein, MK Gold","10. Putting the Human Back into the Digital Humanities: Feminism, Generosity, and Mess",,muse.jhu.edu,,https://muse.jhu.edu/pub/23/oa_edited_volume/chapter/1815132,,185,12/23/24 20:52,,,,,,,,,0,0,0,2,,"… Wikipedia strategy central to its curriculum and later joined those organizing Global Women Wikipedia Write- Ins, Art+Feminism … Mark Nunes has argued that Wikipedia has become “the …",,,Art+Feminism,TRUE,TRUE,185,,0,Art+Feminism,"LF_Klein__MK_Gold_10._Putting_the_Human_Back_into_the_Digital_Humanities_Feminism,_Generosity,_and_Mess.pdf"
0,"L PRINCIPI, E RODRIGUEZ, J REYES",Journalist receives Hearst Award,,core.ac.uk,,https://core.ac.uk/download/pdf/80549069.pdf,,186,12/23/24 20:52,PDF,,,,,,,,0,0,0,3,,… Art+Feminism was started by four friends who wanted to change the way feminism and the arts were written about on Wikipedia… “I think understanding how Wikipedia articles are created …,https://core.ac.uk/download/pdf/80549069.pdf,,Art+Feminism,TRUE,TRUE,186,,0,Art+Feminism,L_PRINCIPI__E_RODRIGUEZ__J_REYES_Journalist_receives_Hearst_Award.pdf
4,R Mitola,University Libraries Co-Curricular Outreach Plan July 2017–June 2019,2019,,digitalscholarship.unlv.edu,https://digitalscholarship.unlv.edu/cgi/viewcontent.cgi?article=1002&context=lib_instr,"https://scholar.google.com/scholar?cites=5036388971710401102&as_sdt=2005&sciodt=0,5&hl=en",187,12/23/24 20:52,PDF,,,,,,,,4,0.8,4,1,5,… will identify gaps in representation on Wikipedia. Students will utilize library resources in order to improve Wikipedia. … Students will utilize library resources in order to improve Wikipedia. …,https://digitalscholarship.unlv.edu/cgi/viewcontent.cgi?article=1002&context=lib_instr,,Art+Feminism,FALSE,,187,,0,0,0
